brand,hotel,kg_co2_sADAGIO,Adagio  Edinburgh Royal Mile,0.000980011IBIS,Ibis New  London Heathrow Airport,0.02335076IBIS,Ibis New  London Euston Station - St Pancras ,0.032771392IBIS,Ibis New  London Greenwich,0.012062094IBIS,Ibis New  Southampton Centre,0.0052394IBIS,Ibis New  London Luton Airport,0.010526141IBIS,Ibis New  Birmingham New Street Station,0.014845099IBIS,Ibis New  Portsmouth Centre,0.011454IBIS,Ibis New  Edinburgh Centre Royal Mile - Hunte,0.007898514IBIS,Ibis New  London Barking,0.005788997IBIS,Ibis New  London Thurrock M25,0.010166763IBIS,Ibis New  London Docklands Canary Wharf,0.006263248IBIS,Ibis New  Cardiff,0.005993427IBIS,Ibis New  London Stratford,0.003692506IBIS,Ibis New  Glasgow City Centre - Sauchiehall S,0.009833821IBIS,Ibis New  Liverpool Centre Albert Dock - Live,0.009133799IBIS,Ibis New  London Wembley,0.012737362IBIS,Ibis New  Manchester Centre Portland Street,0.006173587IBIS,Ibis New  Manchester Centre Princess Street,0.006771181IBIS,Ibis New  Chesterfield North  - Barlborough,0.00556378IBIS,Ibis New  Bradford Shipley,0.003808704IBIS,Ibis New  Cardiff Gate - International Busine,0.004606971IBIS,Ibis New  Chesterfield Centre - Market Town,0.005465772IBIS,Ibis New  Lincoln,0.004846781IBIS,Ibis New  Preston North,0.004701532IBIS,Ibis New  Rotherham East - (M18 / M1),0.004538387IBIS,Ibis New  Wellingborough,0.004478268IBIS,Ibis New  Carlisle City Centre,0.005386461IBIS,Ibis New  Hull City Centre,0.007254234IBIS,Ibis New  Rugby East,0.006488234IBIS,Ibis New  Leeds Centre,0.009647768IBIS,Ibis New  London Excel Docklands,0.008584011IBIS,Ibis New  Northampton Centre,0.007745199IBIS,Ibis New  London City - Shoreditch,0.017159052IBIS,Ibis New  Aberdeen Centre - Entertainment Dis,0.006619714IBIS,Ibis New  Reading Centre,0.007692324IBIS,Ibis New  Bristol Center,0.010528576IBIS,Ibis New  London Earls Court,0.056894472IBIS,Ibis New  Nottingham Centre,0.008546998IBIS,Ibis New  London Elstree Borehamwood,0.007125103IBIS,Ibis  Birmingham Airport - Nec,0.009545308IBIS,Ibis New  Brighton City Centre,0.007529124IBIS,Ibis New  Bristol Temple Meads Quay,0.009141967IBIS,Ibis New  Swansea,0.006153432IBIS,Ibis New  London Shepherd's Bush - Hammersmit,0.00557976IBIS,Ibis New  London Blackfriars,0.016822376IBIS,Ibis New  Edinburgh Centre South Bridge - Roy,0.017850951IBIS,Ibis New  Cambridge Central Station,0.0041635IBIS BUDGET,Ibis Budget  London Barking,0.005367207IBIS BUDGET,Ibis Budget  Glasgow,0.007016583IBIS BUDGET,Ibis Budget  London City Airport,0.003442465IBIS BUDGET,Ibis Budget  Birmingham Centre,0.009956562IBIS BUDGET,Ibis Budget  Leeds Centre,0.007282267IBIS BUDGET,Ibis Budget  Manchester Salford Quays,0.004502347IBIS BUDGET,Ibis Budget  Cardiff Centre,0.005812098IBIS BUDGET,Ibis Budget  Sheffield Arena,0.003684004IBIS BUDGET,Ibis Budget  Southampton Centre,0.002740224IBIS BUDGET,Etap Hotel  Birmingham Airport - Nec,0.006883882IBIS BUDGET,Ibis Budget  Portsmouth,0.005282269IBIS BUDGET,Ibis Budget  London Hounslow,0.005349781IBIS BUDGET,Ibis Budget  Beaconsfield,0.003551071IBIS BUDGET,Ibis Budget  Newport,0.004440134IBIS BUDGET,Ibis Budget  Manchester Centre  Pollard Stree,0.009952688IBIS BUDGET,Etap Hotel  Belfast,0.005639852IBIS BUDGET,Ibis Budget  London Whitechapel - Brick Lane,0.006965178IBIS BUDGET,Ibis Budget  Edinburgh Park,0.006916363IBIS STYLES,Ibis Styles  London Southwark Rose - Borough ,0.007235307IBIS STYLES,Ibis Styles  Liverpool Centre Dale Street,0.008456994IBIS STYLES,Ibis Styles  Edinburgh Centre St Andrew Squar,0.007832794IBIS STYLES,Ibis Styles  Manchester Portland Street,0.041755562MERCURE,Mercure Hotel  London Bridge,0.02278249MERCURE,Mercure Hotel  Salisbury White Hart,0.011882842MERCURE,Mercure Hotel  Blackburn Dunkenhalgh Hotel An,0.025329376MERCURE,Mercure Hotel  Winchester Wessex Hotel,0.011823015MERCURE,Mercure Hotel  London Staines Upon Thames,0.00491854MERCURE,Mercure Hotel  Farnham Bush,0.009878571MERCURE,Mercure Hotel  Cardiff Holland House Hotel An,0.048004629MERCURE,Mercure Hotel  Exeter Southgate,0.014750424MERCURE,Mercure Hotel  Brandon Hall Hotel And Spa War,0.023714676MERCURE,Mercure Hotel  Aberdeen Ardoe House,0.024255794MERCURE,Mercure Hotel  Sheffield St Paul's Hotel And ,0.0387268MERCURE,Mercure Hotel  Stratford-Upon-Avon Shakespear,0.014331629MERCURE,Mercure Hotel  Banbury Whately Hall,0.010214673MERCURE,Mercure Hotel  Box Hill Burford Bridge,0.007974798MERCURE,Mercure Hotel  Oxford Eastgate,0.011265651MERCURE,Mercure Hotel  Bristol Holland House Hotel An,0.036422304MERCURE,Mercure Hotel  Haydock,0.014211029MERCURE,Mercure Hotel  Exeter Rougemont,0.014417573MERCURE,Mercure Hotel  Aberdeen Caledonian,0.01346338MERCURE,Mercure Hotel  Liverpool Atlantic Tower,0.025616874MERCURE,Mercure Hotel  Daventry Court Hotel And Spa,0.010142952MERCURE,Mercure Hotel  Bristol Grand Hotel,0.035152238MERCURE,Mercure Hotel  Dartford Brands Hatch Hotel & ,0.023483164MERCURE,Mercure Hotel  Warwickshire Walton Hall Hotel,0.032167709MGALLERY,Mgallery  Castle Hotel Windsor,0.020217093MGALLERY,Mgallery  Queens Hotel Cheltenham,0.013807452MGALLERY,Mgallery  Francis Hotel Bath,0.012686482NOVOTEL,Novotel  London West,0.141089438NOVOTEL,Novotel  York Centre,0.02121157NOVOTEL,Novotel  Southampton,0.014793315NOVOTEL,Novotel  Birmingham Centre,0.02415374NOVOTEL,Novotel  Newcastle Airport,0.020842597NOVOTEL,Novotel  Birmingham Airport,0.021718783NOVOTEL,Novotel  Sheffield Centre,0.022905106NOVOTEL,Novotel  London Heathrow Airport,0.032858114NOVOTEL,Novotel  London Waterloo,0.025800405NOVOTEL,Novotel  London Tower Bridge,0.024115494NOVOTEL,Novotel  Glasgow Centre,0.018728703NOVOTEL,Novotel  Manchester Centre,0.023522067NOVOTEL,Novotel  London City South,0.02419605NOVOTEL,Novotel  Leeds Centre,0.018812756NOVOTEL,Novotel  Edinburgh Centre,0.026343101NOVOTEL,Novotel  Milton Keynes,0.018234066NOVOTEL,Novotel  London Greenwich,0.018023981NOVOTEL,Novotel  London Excel,0.02508265NOVOTEL,Novotel  Reading Centre,0.023379981NOVOTEL,Novotel  Bristol Centre,0.017959944NOVOTEL,Novotel  Cardiff Centre,0.027990447NOVOTEL,Novotel  London Paddington,0.035911907NOVOTEL,Novotel  Liverpool Centre,0.024009806NOVOTEL,Novotel  Edinburgh Park,0.030011558NOVOTEL,Novotel  London Brentford,0.028523869NOVOTEL,Novotel  London Blackfriars,0.022196291NOVOTEL,Novotel  London Wembley,0.016636158PULLMAN,Pullman  London St Pancras,0.067686353SOFITEL,Sofitel  London Saint James,0.046483709